{
  "schema_version": "1.0",
  "tier": "consumer",
  "id": "consumer-0001",
  "status": "draft",
  "created_at": "2026-02-05T12:00:00Z",
  "reviewer": {
    "reviewer_id": "reviewer-consumer-0001",
    "display_name": "Sample Consumer",
    "country": "United Kingdom"
  },
  "whisky": {
    "name": "Grant's Triple Wood Smoky",
    "category": "blended_scotch",
    "abv": 40
  },
  "tasting": {
    "nose": "…",
    "palate": "…",
    "finish": "…",
    "overall": "…"
  },
  "source": {
    "type": "manual",
    "notes": "Example file for the locked consumer variant."
  }
}
